ATS;ASST;CDC;INDIRIZZO STRUTTURA;NUMERO SERVIZI ATTIVI;% SERVIZI ATTIVI
Ats Brianza;Asst Della Brianza;Casa Di Comunita' Giuditta Vimercate;Via Giuditta Brambilla, 11 - Vimercate (MB);13;100%
Ats Brescia;Asst Degli Spedali Civili Di Brescia;Casa Di Comunita' Brescia Nave;Via Brescia, 155 - Nave (BS);13;100%
Ats Montagna;Asst Della Valtellina E Dell'Alto Lario;Casa Di Comunita' Agoi Bormio;Via Agoi, 8 - Bormio (SO);13;100%
Ats Brescia;Asst Degli Spedali Civili Di Brescia;Casa Di Comunita' Raffaello Travagliato;Via Raffaello, 24 - Travagliato (BS);13;100%
Ats Milano;Asst Fatebenefratelli Sacco;Casa Di Comunita' Don Orione Milano;Via Don Orione, 2 - Milano (MI);13;100%
Ats Brescia;Asst Degli Spedali Civili Di Brescia;Casa Di Comunita' Amadini Tavernole Sul Mella;Via Amadini, 43 - Tavernole Sul Mella (BS);13;100%
Ats Milano;Asst Santi Paolo E Carlo;Casa Di Comunita' Monreale Milano;Via Monreale, 13 - Milano (MI);13;100%
Ats Bergamo;Asst Di Bergamo Ovest;Casa Di Comunita' Betelli Dalmine;Via Betelli, 2 - Dalmine (BG);13;100%
Ats Bergamo;Asst Di Bergamo Ovest;Casa Di Comunita' Maggiore Martinengo;Piazza Maggiore, 11 - Martinengo (BG);13;100%
Ats Bergamo;Asst Di Bergamo Ovest;Casa Di Comunita' Matteotti Treviglio;Via Matteotti, 4 - Treviglio (BG);13;100%
Ats Milano;Asst Melegnano E Della Martesana;Casa Di Comunita' S. Francesco Pioltello;Via S. Francesco, 16 - Pioltello (MI);13;100%
Ats Montagna;Asst Della Valtellina E Dell'Alto Lario;Casa Di Comunita' Pradelli Berbenno Di Valtellina;Via Pradelli, 215 - Berbenno Di Valtellina (SO);13;100%
Ats Brianza;Asst Di Lecco;Casa Di Comunita' Aldo Moro Olgiate Molgora;Via Aldo Moro, 8/10 - Olgiate Molgora (LC);13;100%
Ats Brescia;Asst Degli Spedali Civili Di Brescia;Casa Di Comunita' Mazzini Flero;Via Mazzini, 15 - Flero (BS);13;100%
Ats Milano;Asst Fatebenefratelli Sacco;Casa Di Comunita' Rugabella Milano;Via Rugabella, 4 - Milano (MI);13;100%
Ats Milano;Asst Nord Milano;Casa Di Comunita' Terenghi Cinisello Balsamo;Via Terenghi, 2 - Cinisello Balsamo (MI);13;100%
Ats Brescia;Asst Degli Spedali Civili Di Brescia;Casa Di Comunita' Padana Superiore Ospitaletto;Via Padana Superiore, 98 - Ospitaletto (BS);13;100%
Ats Bergamo;Asst Di Bergamo Est;Casa Di Comunita' Ospedale Calcinate;Piazzale Ospedale, 3 - Calcinate (BG);13;100%
Ats Bergamo;Asst Di Bergamo Est;Casa Di Comunita' Somvico Clusone;Via Somvico, 2 - Clusone (BG);13;100%
Ats Milano;Asst Nord Milano;Casa Di Comunita' Centurelli Bresso;Via Centurelli, 46 - Bresso (MI);13;100%
Ats Val Padana;Asst Di Mantova;Casa Di Comunita' Statale Goitese Goito;Strada Statale Goitese, 313 - Goito (MN);13;100%
Ats Bergamo;Asst Di Bergamo Est;Casa Di Comunita' Polini Vilminore Di Scalve;Via Polini, 7 - Vilminore Di Scalve (BG);13;100%
Ats Brescia;Asst Degli Spedali Civili Di Brescia;Casa Di Comunita' Duca Brescia;Via Duca Degli Abruzzi, 13 - Brescia (BS);13;100%
Ats Montagna;Asst Della Valtellina E Dell'Alto Lario;Casa Di Comunita' Morelli Morbegno;Via Morelli, 1 - Morbegno (SO);13;100%
Ats Milano;Asst Nord Milano;Casa Di Comunita' Ginestra Cusano Milanino;Via Ginestra, 1 - Cusano Milanino (MI);13;100%
Ats Milano;Asst Melegnano E Della Martesana;Casa Di Comunita' Quintini Di Vona Cassano D'Adda;Via Quintini Di Vona, 41 - Cassano D'Adda (MI);13;100%
Ats Insubria;Asst Lariana;Casa Di Comunita' Italia Campione D'Italia;Corso Italia, 10 - Campione D'Italia (CO);13;100%
Ats Insubria;Asst Della Valle Olona;Casa Di Comunita' Stelvio Busto Arsizio;Viale Stelvio, 3 - Busto Arsizio (VA);13;100%
Ats Milano;Asst Fatebenefratelli Sacco;Casa Di Comunita' Farini Milano;Via Farini, 9 - Milano (MI);13;100%
Ats Montagna;Asst Della Valtellina E Dell'Alto Lario;Casa Di Comunita' Cereria Chiavenna;Via Cereria, 4 - Chiavenna (SO);13;100%
Ats Brescia;Asst Degli Spedali Civili Di Brescia;Casa Di Comunita' Fratelli Kennedy Rezzato;Via Fratelli Kennedy, 115 - Rezzato (BS);13;100%
Ats Val Padana;Asst Di Mantova;Casa Di Comunita' Bettini Quistello;Via Bettini, 1 - Quistello (MN);13;100%
Ats Val Padana;Asst Di Crema;Casa Di Comunita' Gramsci Crema;Via Gramsci, 13 - Crema (CR);13;100%
Ats Milano;Asst Melegnano E Della Martesana;Casa Di Comunita' Amendola Segrate;Via Amendola, 3 - Segrate (MI);13;100%
Ats Bergamo;Asst Papa Giovanni Xxiii;Casa Di Comunita' Borgo Palazzo Bergamo;Via Borgo Palazzo, 130 - Bergamo (BG);13;100%
Ats Milano;Asst Gom Niguarda;Casa Di Comunita' Livigno (Ex Jenner) Milano;Via Livigno, 2/A - Milano (MI);13;100%
Ats Bergamo;Asst Di Bergamo Est;Casa Di Comunita' Marconi Seriate;Via Marconi, 38 - Seriate (BG);13;100%
Ats Montagna;Asst Della Valcamonica;Casa Di Comunita' Europa Ponte Di Legno;Piazzale Europa - Ponte Di Legno (BS);13;100%
Ats Milano;Asst Melegnano E Della Martesana;Casa Di Comunita' Cernusco Sul Naviglio;Via Uboldo, 36 - Cernusco Sul Naviglio (MI);13;100%
Ats Bergamo;Asst Papa Giovanni Xxiii;Casa Di Comunita' Roma Villa D'Alme';Via Roma, 16 - Villa D'Almè (BG);13;100%
Ats Insubria;Asst Della Valle Olona;Casa Di Comunita' Fiume Saronno;Via Fiume, 12 - Saronno (VA);13;100%
Ats Bergamo;Asst Papa Giovanni Xxiii;Casa Di Comunita' Belotti Zogno;Piazza Belotti, 1 - Zogno (BG);13;100%
Ats Milano;Asst Nord Milano;Casa Di Comunita' Boccaccio Cologno Monzese;Via Boccaccio, 17 - Cologno Monzese (MI);13;100%
Ats Milano;Asst Santi Paolo E Carlo;Casa Di Comunita' Gola Milano;Via Gola, 22 - Milano (MI);13;100%
Ats Montagna;Asst Della Valcamonica;Casa Di Comunita' Umberto I Berzo Inferiore;Piazza Umberto I, 7 - Berzo Inferiore (BS);13;100%
Ats Insubria;Asst Lariana;Casa Di Comunita' Napoleona Como;Via Napoleona, 60 - Como (CO);13;100%
Ats Insubria;Asst Lariana;Casa Di Comunita' Del Lazzaretto Bellagio;Via Del Lazzaretto, 12 - Bellagio (CO);13;100%
Ats Insubria;Asst Della Valle Olona;Casa Di Comunita' Buttafava Cassano Magnago;Via Buttafava, 15 - Cassano Magnago (VA);13;100%
Ats Insubria;Asst Dei Sette Laghi;Casa Di Comunita' Ceretti Laveno-Mombello;Via Ceretti, 8 - Laveno-Mombello (VA);13;100%
Ats Milano;Asst Ovest Milanese;Casa Di Comunita' Donatore Di Sangue Magenta;Via Donatore Di Sangue, 50 - Magenta (MI);13;100%
Ats Brianza;Asst Della Brianza;Casa Di Comunita' Italia Macherio;Via Italia, 13 - Macherio (MB);13;100%
Ats Brianza;Asst Di Lecco;Casa Di Comunita' Antonio Ghislanzoni Lecco;Via Antonio Ghislanzoni, 9 - Lecco (LC);13;100%
Ats Insubria;Asst Dei Sette Laghi;Casa Di Comunita' Cardinal Dell'Acqua Sesto Calende;Largo Cardinal Dell'Acqua, 1 - Sesto Calende (VA);13;100%
Ats Val Padana;Asst Di Cremona;Casa Di Comunita' San Sebastiano Cremona;Via San Sebastiano, 14 - Cremona (CR);13;100%
Ats Montagna;Asst Della Valcamonica;Casa Di Comunita' Nazionale Cedegolo;Via Nazionale, 103 - Cedegolo (BS);13;100%
Ats Brianza;Asst Della Brianza;Casa Di Comunita' Garibaldi Lentate Sul Seveso;Via Garibaldi, 37 - Lentate Sul Seveso (MB);13;100%
Ats Milano;Asst Di Lodi;Casa Di Comunita' Di Lodi;Viale Savoia, 1 - Lodi (LO);13;100%
Ats Val Padana;Asst Di Mantova;Casa Di Comunita' Schiantarelli Asola;Via Schiantarelli, 3 - Asola (MN);13;100%
Ats Bergamo;Asst Papa Giovanni Xxiii;Casa Di Comunita' Garibaldi Bergamo;Via Garibaldi, 13/15 - Bergamo (BG);13;100%
Ats Bergamo;Asst Papa Giovanni Xxiii;Casa Di Comunita' Vanoncini Sant'Omobono Terme;Via Vanoncini, 25 - Sant'Omobono Terme (BG);13;100%
Ats Milano;Asst Gom Niguarda;Casa Di Comunita' Ippocrate Milano;Via Ippocrate, 45 - Milano (MI);13;100%
Ats Insubria;Asst Della Valle Olona;Casa Di Comunita' Villa Sironi Giovine Italia Gallarate;Piazza Giovine Italia, 2 - Gallarate (VA);13;100%
Ats Brescia;Asst Della Franciacorta;Casa Di Comunita' Aldo Moro Barbariga;Piazza Aldo Moro, 4 - Barbariga (BS);13;100%
Ats Brescia;Asst Degli Spedali Civili Di Brescia;Casa Di Comunita' Corsica Brescia;Via Corsica, 145 - Brescia (BS);13;100%
Ats Brescia;Asst Del Garda;Casa Di Comunita' Repubblica Gargnano;Via Repubblica, 2 - Gargnano (BS);13;100%
Ats Insubria;Asst Lariana;Casa Di Comunita' Italia Olgiate Comasco;Piazza Italia, 8 - Olgiate Comasco (CO);13;100%
Ats Insubria;Asst Lariana;Casa Di Comunita' Casartelli Menaggio;Via Casartelli, 7 - Menaggio (CO);13;100%
Ats Insubria;Asst Lariana;Casa Di Comunita' Garibaldi Porlezza;Via Garibaldi, 64 - Porlezza (CO);13;100%
Ats Pavia;Asst Di Pavia;Casa Di Comunita' Emilia Broni;Via Emilia, 351 - Broni (PV);13;100%
Ats Milano;Asst Di Lodi;Casa Di Comunita' Flemming Casalpusterlengo;Via Fleming, 1 - Casalpusterlengo (LO);13;100%
Ats Milano;Asst Di Lodi;Casa Di Comunita' Gandolfi Codogno;Viale Gandolfi, 2 - Codogno (LO);13;100%
Ats Milano;Asst Melegnano E Della Martesana;Casa Di Comunita' Cavour San Giuliano Milanese;Via Cavour, 15 - San Giuliano Milanese (MI);13;100%
Ats Brianza;Asst Della Brianza;Casa Di Comunita' Corte Dei Frati Bellusco;Via Corte Dei Frati - Bellusco (MB);13;100%
Ats Milano;Asst Nord Milano;Casa Di Comunita' Oslavia Sesto San Giovanni;Via Oslavia, 1 - Sesto San Giovanni (MI);13;100%
Ats Milano;Asst Melegnano E Della Martesana;Casa Di Comunita' Gorizia Trezzo Sull'Adda;Piazzale Gorizia, 2 - Trezzo Sull'Adda (MI);13;100%
Ats Montagna;Asst Della Valtellina E Dell'Alto Lario;Casa Di Comunita' Stelvio Sondrio;Via Stelvio, 35 - Sondrio (SO);13;100%
Ats Insubria;Asst Dei Sette Laghi;Casa Di Comunita' Gradisca Tradate;Via Gradisca, 16 - Tradate (VA);13;100%
Ats Bergamo;Asst Di Bergamo Est;Casa Di Comunita' Nembrini Grumello Del Monte;Via Nembrini, 1 - Grumello Del Monte (BG);13;100%
Ats Milano;Asst Melegnano E Della Martesana;Casa Di Comunita' Don Moletta Vaprio D'Adda;Via Don Moletta, 22 - Vaprio D'Adda (MI);13;100%
Ats Insubria;Asst Della Valle Olona;Casa Di Comunita' Cavour Lonate Pozzolo;Via Cavour, 21 - Lonate Pozzolo (VA);13;100%
Ats Brianza;Asst Della Brianza;Casa Di Comunita' San Cesano Maderno;Via San Carlo, 2/5 - Cesano Maderno (MB);13;100%
Ats Brianza;Asst Della Brianza;Casa Di Comunita' Bernasconi Lissone;Via Bernasconi, 16 - Lissone (MB);13;100%
Ats Montagna;Asst Della Valcamonica;Casa Di Comunita' Marconi Ossimo;Via Marconi, 19 - Ossimo (BS);13;100%
Ats Bergamo;Asst Di Bergamo Est;Casa Di Comunita' Ospedale Trescore Balneario;Via Ospedale, 34 - Trescore Balneario (BG);13;100%
Ats Bergamo;Asst Di Bergamo Est;Casa Di Comunita' Paleocapa Alzano Lombardo;Via Ribolla, 1 - Alzano Lombardo (BG);13;100%
Ats Brianza;Asst Di Lecco;Casa Di Comunita' Montereggio Casatenovo;Via Montereggio, 13 - Casatenovo (LC);13;100%
Ats Milano;Asst Ovest Milanese;Casa Di Comunita' Badi - Rossetti Cuggiono;Via Badi, 2/4 - Cuggiono (MI);13;100%
Ats Insubria;Asst Della Valle Olona;Casa Di Comunita' Plebiscito Busto Arsizio;Piazza Plebiscito, 1 - Busto Arsizio (VA);13;100%
Ats Montagna;Asst Della Valtellina E Dell'Alto Lario;Casa Di Comunita' Pedrotti Tirano;Via Pedrotti, 57 - Tirano (SO);13;100%
Ats Brescia;Asst Della Franciacorta;Casa Di Comunita' Martiri Della Liberta' Chiari;Piazza Martiri Della Liberta', 25 - Chiari (BS);13;100%
Ats Insubria;Asst Dei Sette Laghi;Casa Di Comunita' Di Gazzada Schianno;Via Roma, 18 - Gazzada Schianno (VA);13;100%
Ats Brianza;Asst Della Brianza;Casa Di Comunita' Foscolo Desio;Via Foscolo, 24 - Desio (MB);13;100%
Ats Brianza;Asst Della Brianza;Casa Di Comunita' Verdi Seregno;Via Verdi, 2 - Seregno (MB);13;100%
Ats Brianza;Asst Di Lecco;Casa Di Comunita' Bergamo Calolziocorte;Corso Bergamo, 1 - Calolziocorte (LC);13;100%
Ats Milano;Asst Rhodense;Casa Di Comunita' Piave Bollate;Via Piave, 20 - Bollate (MI);13;100%
Ats Milano;Asst Rhodense;Casa Di Comunita' Cesate Garbagnate Milanese;Via Per Cesate, 62 - Garbagnate Milanese (MI);13;100%
Ats Brianza;Asst Di Lecco;Casa Di Comunita' Carlo Alberto Bellano;Via Carlo Alberto, 25 - Bellano (LC);13;100%
Ats Brianza;Asst Di Lecco;Casa Di Comunita' Mandic Merate;Via Mandic, 1 - Merate (LC);13;100%
Ats Milano;Asst Rhodense;Casa Di Comunita' Dell Repubblica Paderno Dugnano;Viale Della Repubblica, 13 - Paderno Dugnano (MI);13;100%
Ats Milano;Asst Santi Paolo E Carlo;Casa Di Comunita' Baroni;Via Baroni, 48 - Milano (MI);13;100%
Ats Milano;Asst Fatebenefratelli Sacco;Casa Di Comunita' Sassi Milano;Via Sassi, 4 - Milano (MI);13;100%
Ats Milano;Asst Rhodense;Casa Di Comunita' Dei Corsico;Via Dei Lavoratori, 42 - Corsico (MI);13;100%
Ats Milano;Asst Santi Paolo E Carlo;Casa Di Comunita' Stromboli Milano;Via Stromboli, 19 - Milano (MI);13;100%
Ats Val Padana;Asst Di Mantova;Casa Di Comunita' Luigi Cadorna Suzzara;Via Luigi Cadorna, 2 - Suzzara (MN);13;100%
Ats Brianza;Asst Della Brianza;Casa Di Comunita' Viarana Besana In Brianza;Via Viarana, 38 - Besana In Brianza (MB);13;100%
Ats Milano;Asst Fatebenefratelli Sacco;Casa Di Comunita' Ricordi - Doria Milano;Via Doria, 52 - Milano (MI);13;100%
Ats Brianza;Asst Di Lecco;Casa Di Comunita' Sceregalli Introbio;Via Sceregalli, 8/A - Introbio (LC);13;100%
Ats Val Padana;Asst Di Mantova;Casa Di Comunita' Sacchi Castiglione Delle Stiviere;Viale Sacchi, 10/12 - Castiglione Delle Stiviere (MN);13;100%
Ats Montagna;Asst Della Valcamonica;Casa Di Comunita' Nissolina Breno;Via Nissolina, 2 - Breno (BS);13;100%
Ats Brianza;Asst Della Brianza;Casa Di Comunita' Lecco Agrate Brianza;Via Lecco, 11 - Agrate Brianza (MB);13;100%
Ats Val Padana;Asst Di Crema;Casa Di Comunita' Monte Grappa - Garibaldi Rivolta D'Adda;Via Garibaldi, 24 - Rivolta D'Adda (CR);13;100%
Ats Milano;Asst Di Lodi;Casa Di Comunita' F. Cortese Sant'Angelo Lodigiano;Strada Provinciale, 19 - Sant'Angelo Lodigiano (LO);13;100%
Ats Bergamo;Asst Di Bergamo Est;Casa Di Comunita' Bonomelli Lovere;Piazzale Bonomelli, 6 - Lovere (BG);13;100%
Ats Bergamo;Asst Di Bergamo Est;Casa Di Comunita' Sant'Anna Albino;Via Sant'Anna, 5 - Albino (BG);13;100%
Ats Brianza;Asst Della Brianza;Casa Di Comunita' Luca Della Robbia Monza;Via Poliziano, 4 - Monza (MB);13;100%
Ats Brianza;Asst Della Brianza;Casa Di Comunita' Kennedy Brugherio;Via Kennedy, 28 - Brugherio (MB);13;100%
Ats Milano;Asst Fatebenefratelli Sacco;Casa Di Comunita' Piceno Milano;Viale Piceno, 60 - Milano (MI);13;100%
Ats Brescia;Asst Del Garda;Casa Di Comunita' Donatori Del Sangue Leno;Piazza Donatori Del Sangue, 1 - Leno (BS);13;100%
Ats Brescia;Asst Del Garda;Casa Di Comunita' Grimani Verolanuova;Via Grimani, 16/20 - Verolanuova (BS);13;100%
Ats Milano;Asst Gom Niguarda;Casa Di Comunita' Zara Milano;Viale Zara, 81 - Milano (MI);13;100%
Ats Insubria;Asst Dei Sette Laghi;Casa Di Comunita' Monterosa Varese;Viale Monterosa, 28 - Varese (VA);13;100%
Ats Insubria;Asst Dei Sette Laghi;Casa Di Comunita' Campi Maggiori Arcisate;Via Campi Maggiori, 23 - Arcisate (VA);13;100%
Ats Milano;Asst Rhodense;Casa Di Comunita' Liberta' Settimo Milanese;Via Della Liberta', 33 - Settimo Milanese (MI);13;100%
Ats Insubria;Asst Della Valle Olona;Casa Di Comunita' Leonardo Da Vinci Gallarate;Corso Leonardo Da Vinci, 1 - Gallarate (VA);13;100%
Ats Milano;Asst Ovest Milanese;Casa Di Comunita' Candiani Legnano;Via Candiani, 2 - Legnano (MI);13;100%
Ats Milano;Asst Ovest Milanese;Casa Di Comunita' Via XI Febbraio;Via XI Febbraio, 31 - Parabiago (MI);13;100%
Ats Insubria;Asst Della Valle Olona;Casa Di Comunita' Don Minzoni Castellanza;Via Don Minzoni, 25 - Castellanza (VA);13;100%
Ats Brescia;Asst Della Franciacorta;Casa Di Comunita' Bainsizza Orzinuovi;Viale Bainsizza, 22 - Orzinuovi (BS);13;100%
Ats Brescia;Asst Della Franciacorta;Casa Di Comunita' IV Novembre Palazzolo Sull'Oglio;Via IV Novembre, 5 - Palazzolo Sull'Oglio (BS);13;100%
Ats Milano;Asst Melegnano E Della Martesana;Casa Di Comunita' Bellini Gorgonzola;Via Bellini, 5 - Gorgonzola (MI);13;100%
Ats Brescia;Asst Degli Spedali Civili Di Brescia;Casa Di Comunita' Papa Giovanni XXIII Gardone Val Trompia;Via Papa Giovanni XXIII, 4 - Gardone Val Trompia (BS);13;100%
Ats Insubria;Asst Dei Sette Laghi;Casa Di Comunita' Forlanini Luino;Via Forlanini, 6 - Luino (VA);13;100%
Ats Insubria;Asst Dei Sette Laghi;Casa Di Comunita' De Gasperi Gavirate;Piazza De Gasperi, 1 - Gavirate (VA);13;100%
Ats Milano;Asst Melegnano E Della Martesana;Casa Di Comunita' Brambilla Liscate;Via Brambilla, 4/6 - Liscate (MI);13;100%
Ats Insubria;Asst Dei Sette Laghi;Casa Di Comunita' Bordini Angera;Via Bordini, 9 - Angera (VA);13;100%
Ats Milano;Asst Rhodense;Casa Di Comunita' Circonvallazione Lainate;Via Valsesia, 22/V - Lainate (MI);13;100%
Ats Insubria;Asst Della Valle Olona;Casa Di Comunita' Gramsci Fagnano Olona;Piazza Gramsci, 1 - Fagnano Olona (VA);13;100%
Ats Milano;Asst Rhodense;Casa Di Comunita' Settembrini Rho;Via Settembrini, 1 - Rho (MI);13;100%
Ats Milano;Asst Ovest Milanese;Casa Di Comunita' XXIV Maggio Busto Garolfo;Via XXIV Maggio, 19 - Busto Garolfo (MI);13;100%
Ats Brianza;Asst Della Brianza;Casa Di Comunita' Giussani Nova Milanese;Via Giussani, 11 - Nova Milanese (MB);13;100%
Ats Milano;Asst Di Lodi;Casa Di Comunita' Don Pozzoni Zelo Buon Persico;Piazza Don Pozzoni, 2 - Zelo Buon Persico (LO);13;100%
Ats Pavia;Asst Di Pavia;Casa Di Comunita' Circonvallazione Varzi;Via Circonvallazione, 3 - Varzi (PV);13;100%
Ats Insubria;Asst Lariana;Casa Di Comunita' Andreetti Centro Valle Intelvi;Via Andreetti, 12 - Centro Valle Intelvi (CO);13;100%
Ats Pavia;Asst Di Pavia;Casa Di Comunita' Montebello Casteggio;Viale Montebello della Battaglia - Casteggio (PV);13;100%
Ats Val Padana;Asst Di Cremona;Casa Di Comunita' Robbiani Soresina;Via Robbiani, 6 - Soresina (CR);13;100%
Ats Montagna;Asst Della Valcamonica;Casa Di Comunita' Barbolini Darfo Boario Terme;Via Barbolini, 1 - Darfo Boario Terme (BS);13;100%
Ats Bergamo;Asst Di Bergamo Est;Casa Di Comunita' Faccanoni Sarnico;Via Faccanoni, 6 - Sarnico (BG);13;100%
Ats Bergamo;Asst Di Bergamo Est;Casa Di Comunita' Manzoni Gazzaniga;Via Manzoni, 130 - Gazzaniga (BG);13;100%
Ats Brianza;Asst Di Lecco;Casa Di Comunita' Vittorio Bachelet Oggiono;Via Vittorio Bachelet, 8 - Oggiono (LC);13;100%
Ats Milano;Asst Ovest Milanese;Casa Di Comunita' Marconi Gaggiano;Via Marconi, 10 - Gaggiano (MI);13;100%
Ats Milano;Asst Ovest Milanese;Casa Di Comunita' Isonzo Vittuone;Via Isonzo, 1 - Vittuone (MI);13;100%
Ats Milano;Asst Ovest Milanese;Casa Di Comunita' Moroni Castano Primo;Via Moroni, 1 - Castano Primo (MI);13;100%
Ats Milano;Asst Ovest Milanese;Casa Di Comunita' Lodovici Abbiategrasso;Piazza Mussi, 1 - Abbiategrasso (MI);13;100%
Ats Brescia;Asst Degli Spedali Civili Di Brescia;Casa Di Comunita' Marconi Brescia;Via Marconi, 26 - Brescia (BS);13;100%
Ats Montagna;Asst Della Valtellina E Dell'Alto Lario;Casa Di Comunita' Tre Pievi Dongo;Via Gentile - Dongo (CO);13;100%
Ats Brianza;Asst Della Brianza;Casa Di Comunita' Milano Giussano;Via Milano, 65 - Giussano (MB);13;100%
Ats Pavia;Asst Di Pavia;Casa Di Comunita' Dall'Orto Casorate Primo;Via Dall'Orto, 99 - Casorate Primo (PV);13;100%
Ats Insubria;Asst Della Valle Olona;Casa Di Comunita' Cavour Somma Lombardo;Via Cavour, 2 - Somma Lombardo (VA);13;100%
Ats Montagna;Asst Della Valtellina E Dell'Alto Lario;Casa Di Comunita' Livigno Freita;Via Freita, 1521/B - Livigno (SO);13;100%
Ats Pavia;Asst Di Pavia;Casa Di Comunita' Montegrappa Vigevano;Viale Montegrappa, 5 - Vigevano (PV);13;100%
Ats Milano;Asst Rhodense;Casa Di Comunita' Da Vinci Senago;Via Leonardo Da Vinci, 59 - Senago (MI);13;100%
Ats Pavia;Asst Di Pavia;Casa Di Comunita' Borgo Garlasco;Via Borgo San Siro, 2 - Garlasco (PV);13;100%
Ats Pavia;Asst Di Pavia;Casa Di Comunita' Sturla Voghera;Viale Repubblica, 88 - Voghera (PV);13;100%
Ats Pavia;Asst Di Pavia;Casa Di Comunita' Dei Mille 23 Mede;Viale Dei Mille, 23 - Mede (PV);13;100%
Ats Brescia;Asst Della Franciacorta;Casa Di Comunita' Giardini Garibaldi Iseo;Via Giardini Garibaldi, 2 - Iseo (BS);13;100%
Ats Brescia;Asst Della Franciacorta;Casa Di Comunita' Europa Marone;Via Europa, 10 - Marone (BS);13;100%
Ats Brianza;Asst Di Lecco;Casa Di Comunita' Mandello;Via Degli Alpini, 1 - Mandello Del Lario (LC);13;100%
Ats Brianza;Asst Della Brianza;Casa Di Comunita' Monte Limbiate;Via Monte Grappa, 19 - Limbiate (MB);13;100%
Ats Pavia;Asst Di Pavia;Casa Di Comunita' Pavese Mortara;Strada Pavese, 1013 - Mortara (PV);13;100%
Ats Bergamo;Asst Di Bergamo Ovest;Casa Di Comunita' Calusco D'Adda;Via Locatelli, 265 - Calusco D'Adda (BG);13;100%
Ats Bergamo;Asst Di Bergamo Ovest;Casa Di Comunita' Zanica;Via Serio, 1/A - Zanica (BG);13;100%
Ats Milano;Asst Fatebenefratelli Sacco;Casa Di Comunita' Accursio Milano;Piazzale Accursio, 7 - Milano (MI);13;100%
Ats Milano;Asst Fatebenefratelli Sacco;Casa Di Comunita' Aldini Milano;Via Aldini, 72/4 - Milano (MI);13;100%
Ats Milano;Asst Fatebenefratelli Sacco;Casa Di Comunita' Milano Clericetti;Via Clericetti, 22 - Milano (MI);13;100%
Ats Milano;Asst Fatebenefratelli Sacco;Casa Di Comunita' Milano Quarenghi;Via Quarenghi, 21 - Milano (MI);13;100%
Ats Val Padana;Asst Di Mantova;Casa Di Comunita' Xxv Aprile Bozzolo;Via Xxv Aprile, 71 - Bozzolo (MN);13;100%
Ats Val Padana;Asst Di Mantova;Casa Di Comunita' De Gasperi Viadana;Largo De Gasperi, 7 - Viadana (MN);13;100%
Ats Val Padana;Asst Di Mantova;Casa Di Comunita' Albertoni Mantova;Viale Albertoni, 1 - Mantova (MN);13;100%
Ats Val Padana;Asst Di Mantova;Casa Di Comunita' Cesare Battisti Sermide E Felonica;Via Cesare Battisti, 29 - Sermide E Felonica (MN);13;100%
Ats Pavia;Asst Pavia;Casa Di Comunita' Corteolona-Genzone;Viale Dei Longobardi, 3 - Corteolona E Genzone (PV);13;100%
Ats Montagna;Asst Della Valcamonica;Casa Di Comunita' Donatori Edolo;Piazza Donatori Di Sangue, 1 - Edolo (BS);13;100%
Ats Pavia;Irccs S. Matteo;Casa Di Comunita' Cavallotti Belgioioso;Via Cavallotti, 123 - Belgioioso (PV);13;100%
Ats Insubria;Asst Lariana;Casa Di Comunita' Rampanone Lomazzo;Via Del Rampanone, 1 - Lomazzo (CO);13;100%
Ats Insubria;Asst Lariana;Casa Di Comunita' Isonzo Mariano Comense;Via Isonzo, 42/B - Mariano Comense (CO);13;100%
Ats Insubria;Asst Lariana;Casa Di Comunita' Giuseppe Verdi Ponte Lambro;Via Giuseppe Verdi, 3 - Ponte Lambro (CO);13;100%
Ats Pavia;Irccs S. Matteo;Casa Di Comunita' Golgi Pavia;Piazzale Golgi, 19 - Pavia (PV);13;100%
Ats Milano;Asst Rhodense;Casa Di Comunita' Vanzago Cornaredo;Via Vanzago, 58 - Cornaredo (MI);0;0%
Ats Brescia;Asst Del Garda;Casa Di Comunita' G. Falcone Montichiari;Via G. Falcone, 20 - Montichiari (BS);0;0%
Ats Brescia;Asst Del Garda;Casa Di Comunita' Mezzocolle Desenzano Del Garda;Via Mezzocolle - Desenzano Del Garda (BS);0;0%
Ats Insubria;Asst Lariana;Casa Di Comunita' Domea Cantu';Via Domea, 4 - Cantù (CO);13;85%
Ats Brianza;Asst Della Brianza;Casa Di Comunita' Borgazzi Monza;Via Borgazzi, 67 - Monza (MB);13;100%
Ats Insubria;Asst Della Valle Olona;Casa Di Comunita' Stampa Soncino Saronno;Via Stampa Soncino, 4 - Saronno (VA);0;0%
Ats Brescia;Asst Del Garda;Casa Di Comunita' Gosa Gavardo;Via Torsella, 3 - Gavardo (BS);0;0%
Ats Bergamo;Asst Di Bergamo Ovest;Casa Di Comunita' Liberta' Ponte San Pietro;Piazza Liberta', 5 - Ponte San Pietro (BG);12;92%
Ats Brescia;Asst Del Garda;Casa Di Comunita' Gen. Reverberi Vestone;Via Gen. Reverberi, 2 - Vestone (BS);13;85%
Ats Milano;Asst Melegnano E Della Martesana;Casa Di Comunita' Guido Rozzano;Via dei Glicini, 14 - Rozzano (MI);11;85%
Ats Milano;Asst Melegnano E Della Martesana;Casa Di Comunita' S. Francesco - Campania Melegnano;Via S. Francesco - Melegnano (MI);11;31%
Ats Milano;Asst Fatebenefratelli Sacco;Casa Di Comunita' Mercato Gorla V.Le Monza Milano;Viale Monza, 148 - Milano (MI);0;0%
Ats Milano;Asst Nord Milano;Casa Di Comunita' Buonarroti Cormano;Via Tobagi - Cormano (MI);0;0%
Ats Insubria;Asst Dei Sette Laghi;Casa Di Comunita' Acquadro Azzate;Via Acquadro, 6 - Azzate (VA);0;0%
Ats Milano;Asst Ovest Milanese;Casa Di Comunita'  Fratelli Rosselli;Via Fratelli Rosselli, 1 - Parabiago (MI);0;0%
Ats Brianza;Irccs S. Gerardo;Casa Di Comunita' Solferino Monza;Via Solferino, 16 - Monza (MB);13;92%
Ats Brescia;Asst Degli Spedali Civili Di Brescia;Casa Di Comunita' Vender Brescia;Via Don G. Vender - Brescia (BS);0;0%
